commit	phase	tok_per_s	mfu	correctness	compile_s	status	description
2026-08-09T19:28:00	optlevel_O2	config.env+serve_medium.bash	4844	100.0	DISCARD	O2 regresses 7.7% vs O1 (4844 vs 5246)
2026-08-09T19:35:00	section_length_16K	nkilib-fork/core/attention/attention_cte.py	4594	100.0	DISCARD	16K section length regresses 12.4% (SBUF pressure, worse pipelining)
2026-08-09T19:58:00	stochastic_rounding_off	serve_medium.bash	5094	100.0	DISCARD	NEURON_RT_STOCHASTIC_ROUNDING_EN=0 - no measurable impact (within variance)
2026-08-09T19:58:00	softmax_bf16	attention_cte.py wrapper	5103	100.0	DISCARD	softmax_dtype=bfloat16 - no speed improvement (DMA-bound, not compute-bound)
2026-08-10\tcp_dual_call_prior_split\t6864\t7397\t6549\t100.0\tContext Parallel: split k_prior across 4 TP ranks, dual-call (prior-only non-causal + active-only causal), online softmax reduction
2026-08-10\tcp_no_bounds\t8408\t8480\t6894\t100.0\tCP simplified: removed bound_min/bound_max from prior-only call, uses causal_mask=False directly
2026-08-10	local_q_cp	12503	13070	9696	100.0	Scheme 2: Local-Q (skip hidden all_gather, QKV on 1024 local tokens, all_gather KV only, cp_offset for active call, all_reduce O-proj)
